{
  "$schema": "http://json-schema.org/draft-07/schema#",
  "title": "All About Agents baseline inventory",
  "type": "object",
  "additionalProperties": false,
  "required": [
    "schemaVersion",
    "capturedAt",
    "repository",
    "skills",
    "skillSources",
    "sourceFiles",
    "auditDisposition"
  ],
  "properties": {
    "$schema": {
      "type": "string"
    },
    "schemaVersion": {
      "const": 1
    },
    "capturedAt": {
      "type": "string",
      "pattern": "^\\d{4}-\\d{2}-\\d{2}$"
    },
    "repository": {
      "const": "all-about-agents"
    },
    "skills": {
      "type": "array",
      "minItems": 31,
      "maxItems": 31,
      "items": {
        "type": "string",
        "pattern": "^[a-z0-9][a-z0-9-]*$"
      }
    },
    "skillSources": {
      "type": "array",
      "minItems": 31,
      "maxItems": 31,
      "items": {
        "type": "object",
        "additionalProperties": false,
        "required": [
          "name",
          "source",
          "assets",
          "scripts",
          "auditDisposition"
        ],
        "properties": {
          "name": {
            "type": "string"
          },
          "source": {
            "type": "string"
          },
          "assets": {
            "type": "array",
            "items": {
              "type": "string"
            }
          },
          "scripts": {
            "type": "array",
            "items": {
              "type": "string"
            }
          },
          "auditDisposition": {
            "$ref": "#/$defs/auditDisposition"
          }
        }
      }
    },
    "sourceFiles": {
      "type": "array",
      "minItems": 1,
      "items": {
        "type": "object",
        "additionalProperties": false,
        "required": [
          "path",
          "kind",
          "auditDisposition"
        ],
        "properties": {
          "path": {
            "type": "string",
            "minLength": 1
          },
          "kind": {
            "type": "string",
            "enum": [
              "source",
              "asset",
              "script",
              "config",
              "manifest",
              "test",
              "metadata"
            ]
          },
          "auditDisposition": {
            "$ref": "#/$defs/auditDisposition"
          }
        }
      }
    },
    "auditDisposition": {
      "$ref": "#/$defs/auditDisposition"
    }
  },
  "$defs": {
    "auditDisposition": {
      "type": "object",
      "additionalProperties": false,
      "required": [
        "status",
        "reason"
      ],
      "properties": {
        "status": {
          "type": "string",
          "enum": [
            "stable",
            "experimental",
            "manual",
            "quarantined",
            "unsupported",
            "unknown"
          ]
        },
        "reason": {
          "type": "string",
          "minLength": 1
        },
        "unknowns": {
          "type": "array",
          "items": {
            "type": "string",
            "minLength": 1
          }
        }
      }
    }
  }
}
