{
  "schemaVersion": 1,
  "capturedAt": "2026-10-20",
  "repository": "all-about-agents",
  "skills": [
    "brainstorming",
    "codebase-design",
    "diagnosing-agent-workflows",
    "dispatching-parallel-agents",
    "domain-modeling",
    "executing-plans",
    "finishing-a-development-branch",
    "handoff",
    "improve-codebase-architecture",
    "interviewing",
    "loop-me",
    "performance-profiling-and-benchmarking",
    "pr",
    "receiving-code-review",
    "requesting-code-review",
    "research",
    "resolving-merge-conflicts",
    "retro",
    "session-compaction-resilience",
    "subagent-driven-development",
    "systematic-debugging",
    "test-driven-development",
    "threat-modeling-and-security",
    "using-all-about-agents",
    "using-git-worktrees",
    "verification-before-completion",
    "wait-what",
    "wayfinder",
    "writing-plans",
    "writing-skills",
    "zero-downtime-migrations"
  ],
  "skillSources": [
    {
      "name": "brainstorming",
      "source": "skills/brainstorming/SKILL.md",
      "assets": [
        "skills/brainstorming/scripts/frame-template.html",
        "skills/brainstorming/builder-check-prompt.md",
        "skills/brainstorming/visual-companion.md"
      ],
      "scripts": [
        "skills/brainstorming/scripts/helper.js",
        "skills/brainstorming/scripts/lifecycle.cjs",
        "skills/brainstorming/scripts/server.cjs",
        "skills/brainstorming/scripts/start-server.cjs",
        "skills/brainstorming/scripts/start-server.sh",
        "skills/brainstorming/scripts/stop-server.cjs",
        "skills/brainstorming/scripts/stop-server.sh"
      ],
      "auditDisposition": {
        "status": "stable",
        "reason": "Current public skill retained in the unified baseline."
      }
    },
    {
      "name": "codebase-design",
      "source": "skills/codebase-design/SKILL.md",
      "assets": [
        "skills/codebase-design/DEEPENING.md",
        "skills/codebase-design/DESIGN-IT-TWICE.md"
      ],
      "scripts": [],
      "auditDisposition": {
        "status": "stable",
        "reason": "Current public skill retained in the unified baseline."
      }
    },
    {
      "name": "diagnosing-agent-workflows",
      "source": "skills/diagnosing-agent-workflows/SKILL.md",
      "assets": [
        "skills/diagnosing-agent-workflows/references/context-safety.md",
        "skills/diagnosing-agent-workflows/references/report.md"
      ],
      "scripts": [],
      "auditDisposition": {
        "status": "stable",
        "reason": "Portable adaptation of obra/superpowers bb92a77741419a4ab5f06e711a283343f1ada0c3 diagnosing-superpowers; scoped original-evidence diagnosis without export or product paths."
      }
    },
    {
      "name": "dispatching-parallel-agents",
      "source": "skills/dispatching-parallel-agents/SKILL.md",
      "assets": [],
      "scripts": [],
      "auditDisposition": {
        "status": "stable",
        "reason": "Current public skill retained in the unified baseline."
      }
    },
    {
      "name": "domain-modeling",
      "source": "skills/domain-modeling/SKILL.md",
      "assets": [
        "skills/domain-modeling/GLOSSARY-FORMAT.md",
        "skills/domain-modeling/ADR-FORMAT.md"
      ],
      "scripts": [],
      "auditDisposition": {
        "status": "stable",
        "reason": "Portable adaptation of mattpocock/skills 5beb35b040e3de97e54fa9e386d7e42d15c295c2 domain-modeling; lazy glossary/ADR and preserved legacy context."
      }
    },
    {
      "name": "executing-plans",
      "source": "skills/executing-plans/SKILL.md",
      "assets": [],
      "scripts": [
        "skills/executing-plans/scripts/task-done.cjs",
        "skills/executing-plans/scripts/task-start.cjs"
      ],
      "auditDisposition": {
        "status": "stable",
        "reason": "Current public skill retained in the unified baseline."
      }
    },
    {
      "name": "finishing-a-development-branch",
      "source": "skills/finishing-a-development-branch/SKILL.md",
      "assets": [],
      "scripts": [],
      "auditDisposition": {
        "status": "stable",
        "reason": "Current public skill retained in the unified baseline."
      }
    },
    {
      "name": "handoff",
      "source": "skills/handoff/SKILL.md",
      "assets": [],
      "scripts": [],
      "auditDisposition": {
        "status": "stable",
        "reason": "Current public skill retained in the unified baseline."
      }
    },
    {
      "name": "improve-codebase-architecture",
      "source": "skills/improve-codebase-architecture/SKILL.md",
      "assets": [
        "skills/improve-codebase-architecture/HTML-REPORT.md"
      ],
      "scripts": [],
      "auditDisposition": {
        "status": "stable",
        "reason": "Current public skill retained in the unified baseline."
      }
    },
    {
      "name": "interviewing",
      "source": "skills/interviewing/SKILL.md",
      "assets": [],
      "scripts": [],
      "auditDisposition": {
        "status": "stable",
        "reason": "Current public skill retained in the unified baseline."
      }
    },
    {
      "name": "loop-me",
      "source": "skills/loop-me/SKILL.md",
      "assets": [],
      "scripts": [],
      "auditDisposition": {
        "status": "stable",
        "reason": "Current public skill retained in the unified baseline."
      }
    },
    {
      "name": "performance-profiling-and-benchmarking",
      "source": "skills/performance-profiling-and-benchmarking/SKILL.md",
      "assets": [
        "skills/performance-profiling-and-benchmarking/profiling-recipes.md"
      ],
      "scripts": [],
      "auditDisposition": {
        "status": "stable",
        "reason": "Current public skill retained in the unified baseline."
      }
    },
    {
      "name": "pr",
      "source": "skills/pr/SKILL.md",
      "assets": [
        "skills/pr/CREDITS.md"
      ],
      "scripts": [],
      "auditDisposition": {
        "status": "stable",
        "reason": "Portable adaptation of mattpocock/skills 5beb35b040e3de97e54fa9e386d7e42d15c295c2 pr, with Matt Pocock and Dex Horthy attribution; drafting remains separate from publication."
      }
    },
    {
      "name": "receiving-code-review",
      "source": "skills/receiving-code-review/SKILL.md",
      "assets": [],
      "scripts": [],
      "auditDisposition": {
        "status": "stable",
        "reason": "Current public skill retained in the unified baseline."
      }
    },
    {
      "name": "requesting-code-review",
      "source": "skills/requesting-code-review/SKILL.md",
      "assets": [
        "skills/requesting-code-review/code-reviewer.md"
      ],
      "scripts": [],
      "auditDisposition": {
        "status": "stable",
        "reason": "Current public skill retained in the unified baseline."
      }
    },
    {
      "name": "research",
      "source": "skills/research/SKILL.md",
      "assets": [],
      "scripts": [],
      "auditDisposition": {
        "status": "stable",
        "reason": "Current public skill retained in the unified baseline."
      }
    },
    {
      "name": "resolving-merge-conflicts",
      "source": "skills/resolving-merge-conflicts/SKILL.md",
      "assets": [],
      "scripts": [],
      "auditDisposition": {
        "status": "stable",
        "reason": "Current public skill retained in the unified baseline."
      }
    },
    {
      "name": "retro",
      "source": "skills/retro/SKILL.md",
      "assets": [],
      "scripts": [],
      "auditDisposition": {
        "status": "stable",
        "reason": "Portable adaptation of mattpocock/skills 5beb35b040e3de97e54fa9e386d7e42d15c295c2 retro; explicit scoped retrospective and deterministic-check-first recommendations."
      }
    },
    {
      "name": "session-compaction-resilience",
      "source": "skills/session-compaction-resilience/SKILL.md",
      "assets": [
        "skills/session-compaction-resilience/snapshot-template.md"
      ],
      "scripts": [],
      "auditDisposition": {
        "status": "stable",
        "reason": "Current public skill retained in the unified baseline."
      }
    },
    {
      "name": "subagent-driven-development",
      "source": "skills/subagent-driven-development/SKILL.md",
      "assets": [
        "skills/subagent-driven-development/conflict-scan.md",
        "skills/subagent-driven-development/implementer-prompt.md",
        "skills/subagent-driven-development/re-review-prompt.md",
        "skills/subagent-driven-development/task-reviewer-prompt.md"
      ],
      "scripts": [
        "skills/subagent-driven-development/scripts/review-package",
        "skills/subagent-driven-development/scripts/review-package.cjs",
        "skills/subagent-driven-development/scripts/sdd-workspace",
        "skills/subagent-driven-development/scripts/sdd-workspace.cjs",
        "skills/subagent-driven-development/scripts/task-brief",
        "skills/subagent-driven-development/scripts/task-brief.cjs"
      ],
      "auditDisposition": {
        "status": "stable",
        "reason": "Current public skill retained in the unified baseline."
      }
    },
    {
      "name": "systematic-debugging",
      "source": "skills/systematic-debugging/SKILL.md",
      "assets": [
        "skills/systematic-debugging/condition-based-waiting.md",
        "skills/systematic-debugging/defense-in-depth.md",
        "skills/systematic-debugging/feedback-loops.md",
        "skills/systematic-debugging/hitl-loop.template.sh",
        "skills/systematic-debugging/red-flags.md",
        "skills/systematic-debugging/root-cause-tracing.md"
      ],
      "scripts": [
        "skills/systematic-debugging/find-polluter.sh"
      ],
      "auditDisposition": {
        "status": "stable",
        "reason": "Current public skill retained in the unified baseline."
      }
    },
    {
      "name": "test-driven-development",
      "source": "skills/test-driven-development/SKILL.md",
      "assets": [